<?xml version="1.0" encoding="UTF-8"?>
<?xml-stylesheet type="text/xsl" href="/main.xsl"?>
<b:blog xmlns="http://www.w3.org/1999/xhtml" xmlns:b="http://blog.othree.net"  xmlns:xsi="http://www.w3.org/2001/XMLSchema-instance" xsi:schemaLocation="http://blog.othree.net http://blog.othree.net/blooog.xsd">
	<b:blogTitle>O3noBLOG</b:blogTitle>
	<b:blogDescription></b:blogDescription>
	<b:entries>
		<b:entriesMeta>
			<b:listType>s</b:listType>
			<b:listData listID="000583" baseName="my-blog-is-back">My blog is back</b:listData>

			<b:previous>
				<b:mTitle>Opera in Taiwan</b:mTitle>
				<b:mDate>2009-04-30</b:mDate>
				<b:mBase>opera_in_taiwan</b:mBase>
			</b:previous>


			<b:next>
				<b:mTitle>勉勵的話語</b:mTitle>
				<b:mDate>2009-06-02</b:mDate>
				<b:mBase>face-death</b:mBase>
			</b:next>

		</b:entriesMeta>
		<b:entry entryID="000583" baseName="my-blog-is-back">
			<b:author>
				<b:authorName>othree</b:authorName>
				<b:authorEmail>othree@gmail.com</b:authorEmail>
				<b:authorUrl></b:authorUrl>
			</b:author>
			<b:datetime>
				<b:date>2009-05-12</b:date>
				<b:time>11:14:31</b:time>
			</b:datetime>
			<b:category>about</b:category>

			<b:CommentsAccepted>0</b:CommentsAccepted>


			<b:PingsAccepted>0</b:PingsAccepted>

			<b:title>My blog is back</b:title>
			<b:content>
				<b:summary>掛了將近一個月有餘，昨天終於先弄回來，中間一度少掉的文章在 Google Reader 裡都還看的到，所以復原文章也沒花上什麼心力，不過苦工少不了就是，另外在 暫時站 寫的文章也搬過來了，這幾篇同時有用 WTFPL 授權，還順便把 MT 升級到最新的4.25版，本來很想順便改版的，不過一直沒好好設計，這部份就先繼續放著了，反正目前版面我其實還蠻滿意的（除了XHTML實在有夠麻煩）。...</b:summary>
				<b:mainContent><p>掛了將近一個月有餘，昨天終於先弄回來，中間一度少掉的文章在 Google Reader 裡都還看的到，所以復原文章也沒花上什麼心力，不過苦工少不了就是，另外在 <a href="http://othree.github.com">暫時站</a> 寫的文章也搬過來了，這幾篇同時有用 <span class="caps">WTFPL </span>授權，還順便把 MT 升級到最新的4.25版，本來很想順便改版的，不過一直沒好好設計，這部份就先繼續放著了，反正目前版面我其實還蠻滿意的（除了XHTML實在有夠麻煩）。</p></b:mainContent>
				<b:extendContent></b:extendContent>
			</b:content>
			<b:comments commentCount="2">

				<b:comment commentID="098623" entryID="000583">
					<b:author>
						<b:authorName>Thomas</b:authorName>
						<b:authorEmail>web.azltx@gmail.com</b:authorEmail>
						<b:authorUrl></b:authorUrl>
					</b:author>
					<b:datetime>
						<b:date>2009-05-20</b:date>
						<b:time>18:17:12</b:time>
					</b:datetime>
					<b:content>
						<b:mainContent><p>覺得你的網站使用的中文字體相當好看，想請問這是哪種字體呢？謝謝您！</p>
</b:mainContent>
					</b:content>
				</b:comment>

				<b:comment commentID="098627" entryID="000583">
					<b:author>
						<b:authorName>othree.net</b:authorName>
						<b:authorEmail></b:authorEmail>
						<b:authorUrl>http://blog.othree.net</b:authorUrl>
					</b:author>
					<b:datetime>
						<b:date>2009-05-21</b:date>
						<b:time>14:43:23</b:time>
					</b:datetime>
					<b:content>
						<b:mainContent><p>我也不確定你看到的是哪種字體耶，我推測有可能是微軟正黑體啦，建議你可以裝Firebug來看看CSS內容比較正確:P</p>
</b:mainContent>
					</b:content>
				</b:comment>

			</b:comments>
			<b:trackbacks trackbackCount="0" trackbackURL="https://othree.net/mt/mt-tb.cgi/581">

			</b:trackbacks>
		</b:entry>
	</b:entries>
</b:blog>