<?xml version="1.0" encoding="UTF-8"?>
<?xml-stylesheet type="text/xsl" href="/main.xsl"?>
<b:blog xmlns="http://www.w3.org/1999/xhtml" xmlns:b="http://blog.othree.net"  xmlns:xsi="http://www.w3.org/2001/XMLSchema-instance" xsi:schemaLocation="http://blog.othree.net http://blog.othree.net/blooog.xsd">
	<b:blogTitle>O3noBLOG</b:blogTitle>
	<b:blogDescription></b:blogDescription>
	<b:entries>
		<b:entriesMeta>
			<b:listType>s</b:listType>
			<b:listData listID="000288" baseName="lovely-penguin">可愛企鵝圖示</b:listData>

			<b:previous>
				<b:mTitle>與壞電腦為伍的一天</b:mTitle>
				<b:mDate>2005-11-30</b:mDate>
				<b:mBase>a-day-with-broken-computers</b:mBase>
			</b:previous>


			<b:next>
				<b:mTitle>新酷音輸入法支援unicode了</b:mTitle>
				<b:mDate>2005-12-02</b:mDate>
				<b:mBase>chewing-support-unicode</b:mBase>
			</b:next>

		</b:entriesMeta>
		<b:entry entryID="000288" baseName="lovely-penguin">
			<b:author>
				<b:authorName>othree</b:authorName>
				<b:authorEmail>othree@gmail.com</b:authorEmail>
				<b:authorUrl></b:authorUrl>
			</b:author>
			<b:datetime>
				<b:date>2005-12-01</b:date>
				<b:time>23:10:10</b:time>
			</b:datetime>
			<b:category>web</b:category>

			<b:CommentsAccepted>0</b:CommentsAccepted>


			<b:PingsAccepted>0</b:PingsAccepted>

			<b:title>可愛企鵝圖示</b:title>
			<b:content>
				<b:summary> 之前在MSN上看到朋友用了這個企鵝的圖作表情符號，真的很可愛，不過一直找不齊，也找不到來源，前兩天終於有朋友告訴我是哪裡來的了（感動T_T），Emperor Penguin Empire，這些圖片其實是網頁素材，使用規約大致如下： 原作者保留著作權 個人網頁使用OK 不允許任何二次加工 商業網站和網頁製作公司請勿使用 請勿冒名說是自創圖示 大家使用圖片的同時小心不要觸犯了喔。...</b:summary>
				<b:mainContent><p><img src="http://blog.othree.net/log/2005/12/01/lovely_penguin/roll_pen11.gif" alt="轉動的企鵝" /></p>

<p>之前在MSN上看到朋友用了這個企鵝的圖作表情符號，真的很可愛，不過一直找不齊，也找不到來源，前兩天終於有朋友告訴我是哪裡來的了（感動T_T），<a href="http://www.peso.nu/">Emperor Penguin Empire</a>，這些圖片其實是網頁素材，使用規約大致如下：</p>


<ol>
<li>原作者保留著作權</li>
<li>個人網頁使用OK</li>
<li>不允許任何二次加工</li>
<li>商業網站和網頁製作公司請勿使用</li>
<li>請勿冒名說是自創圖示</li>
</ol>



<p>大家使用圖片的同時小心不要觸犯了喔。</p></b:mainContent>
				<b:extendContent></b:extendContent>
			</b:content>
			<b:comments commentCount="7">

				<b:comment commentID="000918" entryID="000288">
					<b:author>
						<b:authorName>Kej</b:authorName>
						<b:authorEmail></b:authorEmail>
						<b:authorUrl>http://kej.tw/</b:authorUrl>
					</b:author>
					<b:datetime>
						<b:date>2005-12-02</b:date>
						<b:time>00:00:24</b:time>
					</b:datetime>
					<b:content>
						<b:mainContent><p>喔喔喔～我想找他的原始網站也找了好久
沒想到終於在這裡看到了(泣)</p>
</b:mainContent>
					</b:content>
				</b:comment>

				<b:comment commentID="000921" entryID="000288">
					<b:author>
						<b:authorName>瑞明</b:authorName>
						<b:authorEmail></b:authorEmail>
						<b:authorUrl></b:authorUrl>
					</b:author>
					<b:datetime>
						<b:date>2005-12-06</b:date>
						<b:time>18:22:04</b:time>
					</b:datetime>
					<b:content>
						<b:mainContent><p>這隻不夠可愛！@_@</p>
</b:mainContent>
					</b:content>
				</b:comment>

				<b:comment commentID="000923" entryID="000288">
					<b:author>
						<b:authorName>OOO</b:authorName>
						<b:authorEmail></b:authorEmail>
						<b:authorUrl>http://blog.othree.net</b:authorUrl>
					</b:author>
					<b:datetime>
						<b:date>2005-12-07</b:date>
						<b:time>10:40:33</b:time>
					</b:datetime>
					<b:content>
						<b:mainContent><p>明明就很可愛>&lt;</p>
</b:mainContent>
					</b:content>
				</b:comment>

				<b:comment commentID="001273" entryID="000288">
					<b:author>
						<b:authorName>213</b:authorName>
						<b:authorEmail></b:authorEmail>
						<b:authorUrl></b:authorUrl>
					</b:author>
					<b:datetime>
						<b:date>2006-06-15</b:date>
						<b:time>09:48:11</b:time>
					</b:datetime>
					<b:content>
						<b:mainContent><p>(^.^)&#8212;&#8212;&#8212;&#8212;&#8212;&#8212;&#8212;&#8212;&#8212;&#8212;&#8212;&#8212;&#8212;&#8212;-</p>
</b:mainContent>
					</b:content>
				</b:comment>

				<b:comment commentID="013706" entryID="000288">
					<b:author>
						<b:authorName>ammng</b:authorName>
						<b:authorEmail></b:authorEmail>
						<b:authorUrl>http://http:/</b:authorUrl>
					</b:author>
					<b:datetime>
						<b:date>2007-03-26</b:date>
						<b:time>17:17:16</b:time>
					</b:datetime>
					<b:content>
						<b:mainContent><p>可愛的企鵝</p>
</b:mainContent>
					</b:content>
				</b:comment>

				<b:comment commentID="013707" entryID="000288">
					<b:author>
						<b:authorName>ammng</b:authorName>
						<b:authorEmail></b:authorEmail>
						<b:authorUrl></b:authorUrl>
					</b:author>
					<b:datetime>
						<b:date>2007-03-26</b:date>
						<b:time>17:17:38</b:time>
					</b:datetime>
					<b:content>
						<b:mainContent><p>可愛的企鵝</p>
</b:mainContent>
					</b:content>
				</b:comment>

				<b:comment commentID="073371" entryID="000288">
					<b:author>
						<b:authorName>Amma</b:authorName>
						<b:authorEmail></b:authorEmail>
						<b:authorUrl></b:authorUrl>
					</b:author>
					<b:datetime>
						<b:date>2008-07-30</b:date>
						<b:time>17:50:01</b:time>
					</b:datetime>
					<b:content>
						<b:mainContent><p>卡挖依&#8230;好可愛的企鵝喔~>&lt;~   ^^
有誰能跟我說還有哪些可愛的圖示  感恩喔!!</p>
</b:mainContent>
					</b:content>
				</b:comment>

			</b:comments>
			<b:trackbacks trackbackCount="2" trackbackURL="https://othree.net/mt/mt-tb.cgi/287">

				<b:trackback trackbackID="13" entryID="000288">
					<b:pingTitle>帝企鹅帝国: GIF 图标</b:pingTitle>
					<b:datetime>
						<b:date>2005-12-02</b:date>
						<b:time>10:43:09</b:time>
					</b:datetime>
					<b:pingBlogName>3rdeye</b:pingBlogName>
					<b:pingURL>http://3eye.name/blog/?id=111</b:pingURL>
					<b:pingExcerpt><a href="http://www.peso.nu/" rel="nofollow"></a>
<p>QQ 上很多人用这只可爱的企鹅做表情图标~ 一直希望集齐的但苦苦搜寻无果, 今</p></b:pingExcerpt>
				</b:trackback>

				<b:trackback trackbackID="14" entryID="000288">
					<b:pingTitle>可愛的企鵝圖示：Emperor Penguin Empire</b:pingTitle>
					<b:datetime>
						<b:date>2005-12-06</b:date>
						<b:time>23:09:53</b:time>
					</b:datetime>
					<b:pingBlogName>KeBlog‧Kej's weblog</b:pingBlogName>
					<b:pingURL>http://blog.kej.tw/2005-12/06/emperor-penguin-empire/</b:pingURL>
					<b:pingExcerpt>	自從A君丟給我幾個超可愛的企鵝圖示之後，我們倆便開始瘋狂的(?)在網路上尋找哪邊有更多的同系列圖示，並且想找出他的來源或官方網站，但是一直都找不到(太笨？)
	直到前幾天在O3noBLOG ...</b:pingExcerpt>
				</b:trackback>

			</b:trackbacks>
		</b:entry>
	</b:entries>
</b:blog>